<?xml version="1.0" encoding="UTF-8" ?>
<!DOCTYPE entity SYSTEM "dtd/entity.dtd">
<entity xmlns:entity="http://www.myproject.com/xml/entity" 
		xmlns:field="http://www.myproject.com/xml/field" 
		name="Pizza" 
		packageName="org.junior.asamson.domain" 
		entity:persistenceType="jpa"
		entity:activeRecorde="false">
				
	<fields>
		<field field:name="name" field:type="String" field:notNull="true" field:sizeMin="2"></field>
		<field field:name="price" field:type="double"></field>
	</fields>
		
	<relationships>
		<relationship field:name="toppings" field:type="Topping" field:cardinality="ManyToMany"></relationship>
		<relationship field:name="base" field:type="Base" field:cardinality="ManyToOne"></relationship>
	</relationships>
	
	<repository	name="PizzaRepository"
		    	packageName="org.junior.asamson.repository">
	</repository>
	
	<service name="Pizza2Service"
			 packageName="org.junior.asamson.service">
	</service>
</entity>
		
		
		
