<?xml version="1.0" encoding="UTF-8" ?>
<!DOCTYPE entity SYSTEM "dtd/entity.dtd">
<entity xmlns:entity="http://www.myproject.com/xml/entity" 
		xmlns:field="http://www.myproject.com/xml/field" 
		name="PizzaOrder" 
		packageName="org.junior.asamson.domain" 
		entity:persistenceType="jpa"
		entity:activeRecorde="false">
				
	<fields>
		<field field:name="name" field:type="String" field:notNull="true" field:sizeMin="2"></field>
		<field field:name="adresse" field:type="String" field:sizeMin="30"></field>
		<field field:name="total" field:type="Double"></field>
		<field field:name="deliveryDate" field:type="Date" field:dateTimeFormatPattern="M-"></field>
	</fields>
		
	<relationships>
		<relationship field:name="pizzas"  field:type="Pizza" field:notNull="true" field:cardinality="ManyToMany"></relationship>
	</relationships>
	
	<repository	name="PizzaRepository"
		    	packageName="org.junior.asamson.repository">
	</repository>
	
	<service name="Pizza2Service"
			 packageName="org.junior.asamson.service">
	</service>
</entity>
		
		
		
